{
  "$schema": "http://json-schema.org/draft-07/schema#",
  "title": "TransitJSON Fare",
  "description": "Ücret tanımı. Bir agency'nin farklı yolcu profilleri (tam, öğrenci, 65+) veya farklı ücret modelleri (sabit, zone, mesafe) için ayrı fare kayıtları oluşturulur.",
  "type": "object",
  "properties": {
    "fare_id": {
      "type": "string",
      "description": "Proje genelinde tekil. Örn. 'BUR-tam', 'BUR-ogrenci', 'IST-zone-ab'."
    },
    "agency_id": {
      "type": "string",
      "description": "Bu ücretin ait olduğu ajans."
    },
    "name": {
      "type": "string",
      "description": "İnsan-okunur ücret adı. Örn. 'Tam Bilet', 'Öğrenci', '65+ Ücretsiz'."
    },
    "fare_type": {
      "type": "string",
      "enum": ["flat", "zone", "distance"],
      "description": "flat: sabit ücret (tüm hat boyunca aynı fiyat). zone: bölge bazlı (fare_rules.json ile tanımlanır). distance: mesafe bazlı (fare_rules.json ile tanımlanır)."
    },
    "price": {
      "type": "number",
      "minimum": 0,
      "description": "Birim fiyat. flat için tam fiyat; zone/distance için baz fiyat."
    },
    "currency": {
      "type": "string",
      "pattern": "^[A-Z]{3}$",
      "description": "ISO 4217 para birimi kodu. Örn. 'TRY', 'EUR', 'USD'."
    },
    "payment_methods": {
      "type": "array",
      "items": {
        "type": "string",
        "enum": ["cash", "smart_card", "credit_card", "mobile", "contactless", "qr"]
      },
      "description": "Kabul edilen ödeme yöntemleri. cash: nakit, smart_card: kent kart/akbil, credit_card: kredi/banka kartı, mobile: mobil uygulama, contactless: temassız, qr: QR kod."
    },
    "transfer_duration": {
      "type": ["integer", "null"],
      "minimum": 0,
      "description": "Aktarma süresi (dakika). Bu süre içinde yapılan aktarmalarda ek ücret alınmaz. null = aktarma hakkı yok."
    },
    "transfer_limit": {
      "type": ["integer", "null"],
      "minimum": 0,
      "description": "transfer_duration süresi içinde kaç aktarma hakkı var. null = sınırsız (süre dolana kadar)."
    },
    "updated_at": {
      "type": "string",
      "format": "date-time"
    },
    "source": {
      "type": "string"
    }
  },
  "required": ["fare_id", "agency_id", "name", "fare_type", "price", "currency", "updated_at"],
  "additionalProperties": false
}
