[
  {
    "fare_id": "SAK_0001_FARE_60_65",
    "agency_id": "sbb",
    "name": "ADARAY - 60-65 Yaş Bileti",
    "fare_type": "flat",
    "price": 14.0,
    "currency": "TRY",
    "payment_methods": [
      "smart_card"
    ],
    "updated_at": "2026-07-26T20:06:26Z",
    "source": "api-sbb"
  },
  {
    "fare_id": "SAK_0001_FARE_ÖĞRENCI",
    "agency_id": "sbb",
    "name": "ADARAY - Öğrenci",
    "fare_type": "flat",
    "price": 10.0,
    "currency": "TRY",
    "payment_methods": [
      "smart_card"
    ],
    "updated_at": "2026-07-26T20:06:26Z",
    "source": "api-sbb"
  },
  {
    "fare_id": "SAK_0001_FARE_OGRETMEN",
    "agency_id": "sbb",
    "name": "ADARAY - Öğretmen Bileti",
    "fare_type": "flat",
    "price": 23.8,
    "currency": "TRY",
    "payment_methods": [
      "smart_card"
    ],
    "updated_at": "2026-07-26T20:06:26Z",
    "source": "api-sbb"
  },
  {
    "fare_id": "SAK_0001_FARE_TAM",
    "agency_id": "sbb",
    "name": "ADARAY - Tam Bilet",
    "fare_type": "flat",
    "price": 28.0,
    "currency": "TRY",
    "payment_methods": [
      "smart_card"
    ],
    "updated_at": "2026-07-26T20:06:26Z",
    "source": "api-sbb"
  },
  {
    "fare_id": "SAK_0002_FARE_60_65",
    "agency_id": "sbb",
    "name": "GAR MEYDANI - KORUCUK - 60-65 Yaş Bileti",
    "fare_type": "flat",
    "price": 5.0,
    "currency": "TRY",
    "payment_methods": [
      "smart_card"
    ],
    "updated_at": "2026-07-26T20:06:26Z",
    "source": "api-sbb"
  },
  {
    "fare_id": "SAK_0002_FARE_ÖĞRENCI",
    "agency_id": "sbb",
    "name": "GAR MEYDANI - KORUCUK - Öğrenci",
    "fare_type": "flat",
    "price": 5.0,
    "currency": "TRY",
    "payment_methods": [
      "smart_card"
    ],
    "updated_at": "2026-07-26T20:06:26Z",
    "source": "api-sbb"
  },
  {
    "fare_id": "SAK_0002_FARE_OGRETMEN",
    "agency_id": "sbb",
    "name": "GAR MEYDANI - KORUCUK - Öğretmen Bileti",
    "fare_type": "flat",
    "price": 8.5,
    "currency": "TRY",
    "payment_methods": [
      "smart_card"
    ],
    "updated_at": "2026-07-26T20:06:26Z",
    "source": "api-sbb"
  },
  {
    "fare_id": "SAK_0002_FARE_TAM",
    "agency_id": "sbb",
    "name": "GAR MEYDANI - KORUCUK - Tam Bilet",
    "fare_type": "flat",
    "price": 10.0,
    "currency": "TRY",
    "payment_methods": [
      "smart_card"
    ],
    "updated_at": "2026-07-26T20:06:26Z",
    "source": "api-sbb"
  },
  {
    "fare_id": "SAK_0003_FARE_60_65",
    "agency_id": "sbb",
    "name": "SAKARYAPARK - KÜPÇÜLER - K. TERMİNAL - 60-65 Yaş Bileti",
    "fare_type": "flat",
    "price": 10.0,
    "currency": "TRY",
    "payment_methods": [
      "smart_card"
    ],
    "updated_at": "2026-07-26T20:06:26Z",
    "source": "api-sbb"
  },
  {
    "fare_id": "SAK_0003_FARE_ÖĞRENCI",
    "agency_id": "sbb",
    "name": "SAKARYAPARK - KÜPÇÜLER - K. TERMİNAL - Öğrenci",
    "fare_type": "flat",
    "price": 10.0,
    "currency": "TRY",
    "payment_methods": [
      "smart_card"
    ],
    "updated_at": "2026-07-26T20:06:26Z",
    "source": "api-sbb"
  },
  {
    "fare_id": "SAK_0003_FARE_OGRETMEN",
    "agency_id": "sbb",
    "name": "SAKARYAPARK - KÜPÇÜLER - K. TERMİNAL - Öğretmen Bileti",
    "fare_type": "flat",
    "price": 17.0,
    "currency": "TRY",
    "payment_methods": [
      "smart_card"
    ],
    "updated_at": "2026-07-26T20:06:26Z",
    "source": "api-sbb"
  },
  {
    "fare_id": "SAK_0003_FARE_TAM",
    "agency_id": "sbb",
    "name": "SAKARYAPARK - KÜPÇÜLER - K. TERMİNAL - Tam Bilet",
    "fare_type": "flat",
    "price": 20.0,
    "currency": "TRY",
    "payment_methods": [
      "smart_card"
    ],
    "updated_at": "2026-07-26T20:06:26Z",
    "source": "api-sbb"
  },
  {
    "fare_id": "SAK_0004_FARE_60_65",
    "agency_id": "sbb",
    "name": "ORTA GARAJ - HIZIR İLYAS - 60-65 Yaş Bileti",
    "fare_type": "flat",
    "price": 10.0,
    "currency": "TRY",
    "payment_methods": [
      "smart_card"
    ],
    "updated_at": "2026-07-26T20:06:26Z",
    "source": "api-sbb"
  },
  {
    "fare_id": "SAK_0004_FARE_ÖĞRENCI",
    "agency_id": "sbb",
    "name": "ORTA GARAJ - HIZIR İLYAS - Öğrenci",
    "fare_type": "flat",
    "price": 10.0,
    "currency": "TRY",
    "payment_methods": [
      "smart_card"
    ],
    "updated_at": "2026-07-26T20:06:26Z",
    "source": "api-sbb"
  },
  {
    "fare_id": "SAK_0004_FARE_OGRETMEN",
    "agency_id": "sbb",
    "name": "ORTA GARAJ - HIZIR İLYAS - Öğretmen Bileti",
    "fare_type": "flat",
    "price": 17.0,
    "currency": "TRY",
    "payment_methods": [
      "smart_card"
    ],
    "updated_at": "2026-07-26T20:06:26Z",
    "source": "api-sbb"
  },
  {
    "fare_id": "SAK_0004_FARE_TAM",
    "agency_id": "sbb",
    "name": "ORTA GARAJ - HIZIR İLYAS - Tam Bilet",
    "fare_type": "flat",
    "price": 20.0,
    "currency": "TRY",
    "payment_methods": [
      "smart_card"
    ],
    "updated_at": "2026-07-26T20:06:26Z",
    "source": "api-sbb"
  },
  {
    "fare_id": "SAK_0005_FARE_60_65",
    "agency_id": "sbb",
    "name": "D. MEYDANI - YEŞİLTEPE - Y. TERMİNAL - 60-65 Yaş Bileti",
    "fare_type": "flat",
    "price": 10.0,
    "currency": "TRY",
    "payment_methods": [
      "smart_card"
    ],
    "updated_at": "2026-07-26T20:06:26Z",
    "source": "api-sbb"
  },
  {
    "fare_id": "SAK_0005_FARE_ÖĞRENCI",
    "agency_id": "sbb",
    "name": "D. MEYDANI - YEŞİLTEPE - Y. TERMİNAL - Öğrenci",
    "fare_type": "flat",
    "price": 10.0,
    "currency": "TRY",
    "payment_methods": [
      "smart_card"
    ],
    "updated_at": "2026-07-26T20:06:26Z",
    "source": "api-sbb"
  },
  {
    "fare_id": "SAK_0005_FARE_OGRETMEN",
    "agency_id": "sbb",
    "name": "D. MEYDANI - YEŞİLTEPE - Y. TERMİNAL - Öğretmen Bileti",
    "fare_type": "flat",
    "price": 17.0,
    "currency": "TRY",
    "payment_methods": [
      "smart_card"
    ],
    "updated_at": "2026-07-26T20:06:26Z",
    "source": "api-sbb"
  },
  {
    "fare_id": "SAK_0005_FARE_TAM",
    "agency_id": "sbb",
    "name": "D. MEYDANI - YEŞİLTEPE - Y. TERMİNAL - Tam Bilet",
    "fare_type": "flat",
    "price": 20.0,
    "currency": "TRY",
    "payment_methods": [
      "smart_card"
    ],
    "updated_at": "2026-07-26T20:06:26Z",
    "source": "api-sbb"
  },
  {
    "fare_id": "SAK_0006_FARE_60_65",
    "agency_id": "sbb",
    "name": "KAMPÜS - SAKARYAPARK - 60-65 Yaş Bileti",
    "fare_type": "flat",
    "price": 10.0,
    "currency": "TRY",
    "payment_methods": [
      "smart_card"
    ],
    "updated_at": "2026-07-26T20:06:26Z",
    "source": "api-sbb"
  },
  {
    "fare_id": "SAK_0006_FARE_ÖĞRENCI",
    "agency_id": "sbb",
    "name": "KAMPÜS - SAKARYAPARK - Öğrenci",
    "fare_type": "flat",
    "price": 10.0,
    "currency": "TRY",
    "payment_methods": [
      "smart_card"
    ],
    "updated_at": "2026-07-26T20:06:26Z",
    "source": "api-sbb"
  },
  {
    "fare_id": "SAK_0006_FARE_OGRETMEN",
    "agency_id": "sbb",
    "name": "KAMPÜS - SAKARYAPARK - Öğretmen Bileti",
    "fare_type": "flat",
    "price": 17.0,
    "currency": "TRY",
    "payment_methods": [
      "smart_card"
    ],
    "updated_at": "2026-07-26T20:06:26Z",
    "source": "api-sbb"
  },
  {
    "fare_id": "SAK_0006_FARE_TAM",
    "agency_id": "sbb",
    "name": "KAMPÜS - SAKARYAPARK - Tam Bilet",
    "fare_type": "flat",
    "price": 20.0,
    "currency": "TRY",
    "payment_methods": [
      "smart_card"
    ],
    "updated_at": "2026-07-26T20:06:26Z",
    "source": "api-sbb"
  },
  {
    "fare_id": "SAK_0007_FARE_60_65",
    "agency_id": "sbb",
    "name": "O.GARAJ - OTUZİKİEVLER - BEŞKÖPRÜ - KAMPÜS - 60-65 Yaş Bileti",
    "fare_type": "flat",
    "price": 10.0,
    "currency": "TRY",
    "payment_methods": [
      "smart_card"
    ],
    "updated_at": "2026-07-26T20:06:26Z",
    "source": "api-sbb"
  },
  {
    "fare_id": "SAK_0007_FARE_ÖĞRENCI",
    "agency_id": "sbb",
    "name": "O.GARAJ - OTUZİKİEVLER - BEŞKÖPRÜ - KAMPÜS - Öğrenci",
    "fare_type": "flat",
    "price": 10.0,
    "currency": "TRY",
    "payment_methods": [
      "smart_card"
    ],
    "updated_at": "2026-07-26T20:06:26Z",
    "source": "api-sbb"
  },
  {
    "fare_id": "SAK_0007_FARE_OGRETMEN",
    "agency_id": "sbb",
    "name": "O.GARAJ - OTUZİKİEVLER - BEŞKÖPRÜ - KAMPÜS - Öğretmen Bileti",
    "fare_type": "flat",
    "price": 17.0,
    "currency": "TRY",
    "payment_methods": [
      "smart_card"
    ],
    "updated_at": "2026-07-26T20:06:26Z",
    "source": "api-sbb"
  },
  {
    "fare_id": "SAK_0007_FARE_TAM",
    "agency_id": "sbb",
    "name": "O.GARAJ - OTUZİKİEVLER - BEŞKÖPRÜ - KAMPÜS - Tam Bilet",
    "fare_type": "flat",
    "price": 20.0,
    "currency": "TRY",
    "payment_methods": [
      "smart_card"
    ],
    "updated_at": "2026-07-26T20:06:26Z",
    "source": "api-sbb"
  },
  {
    "fare_id": "SAK_0008_FARE_60_65",
    "agency_id": "sbb",
    "name": "D. MEYDANI - YILDIZTEPE - Y. TERMİNAL - 60-65 Yaş Bileti",
    "fare_type": "flat",
    "price": 10.0,
    "currency": "TRY",
    "payment_methods": [
      "smart_card"
    ],
    "updated_at": "2026-07-26T20:06:26Z",
    "source": "api-sbb"
  },
  {
    "fare_id": "SAK_0008_FARE_ÖĞRENCI",
    "agency_id": "sbb",
    "name": "D. MEYDANI - YILDIZTEPE - Y. TERMİNAL - Öğrenci",
    "fare_type": "flat",
    "price": 10.0,
    "currency": "TRY",
    "payment_methods": [
      "smart_card"
    ],
    "updated_at": "2026-07-26T20:06:26Z",
    "source": "api-sbb"
  },
  {
    "fare_id": "SAK_0008_FARE_OGRETMEN",
    "agency_id": "sbb",
    "name": "D. MEYDANI - YILDIZTEPE - Y. TERMİNAL - Öğretmen Bileti",
    "fare_type": "flat",
    "price": 17.0,
    "currency": "TRY",
    "payment_methods": [
      "smart_card"
    ],
    "updated_at": "2026-07-26T20:06:26Z",
    "source": "api-sbb"
  },
  {
    "fare_id": "SAK_0008_FARE_TAM",
    "agency_id": "sbb",
    "name": "D. MEYDANI - YILDIZTEPE - Y. TERMİNAL - Tam Bilet",
    "fare_type": "flat",
    "price": 20.0,
    "currency": "TRY",
    "payment_methods": [
      "smart_card"
    ],